Сorp.ID;Speaker;gender;Recording;URL;Context;Token;Realization;Year;ph.context;age.in.2019
61727;егп1928;f;N20130623e;http://www.parasolcorpus.org/Pushkino/OUT/N20130623e-305771-307779.wav;А #ещё# , ещё и голодно.;ещё;ʂtʂ;1928;intervoc;91
61729;егп1928;f;N20130623e;http://www.parasolcorpus.org/Pushkino/OUT/N20130623e-305771-307779.wav;А ещё, #ещё# и голодно.;ещё;ʂtʂ;1928;intervoc;91
62179;егп1928;f;N20130623e;http://www.parasolcorpus.org/Pushkino/OUT/N20130623e-485992-490475.wav;Семьдесят восемь лет ей было как она умерла, так она четыре года без отца #ещё# жила;ещё;ʂtʂ;1928;intervoc;91
62777;егп1928;f;N20130623e;http://www.parasolcorpus.org/Pushkino/OUT/N20130623e-755490-758196.wav;А тут #ещё# их тоже тоже брат жил.;ещё;ʂtʂ;1928;intervoc;91
302852;егп1928;f;20130705c-egp;http://www.parasolcorpus.org/Pushkino/OUT/20130705c-egp-2719930-2722749.wav;Кусачие были #ещё# , < держит > конь < де >.;ещё;ʂtʂ;1928;intervoc;91
303864;егп1928;f;20130705c-egp;http://www.parasolcorpus.org/Pushkino/OUT/20130705c-egp-3135147-3138344.wav;Читала. Пока #ещё# были небольшие - то дак.;ещё;ʂtʂ;1928;intervoc;91
36052;егп1928;f;20140624b-egp-1;http://www.parasolcorpus.org/Pushkino/OUT/20140624b-egp-1-1143875-1150159.wav;Нет, у меня была #ещё# меня на год постарше, но она моему отцу сестра была родная, Дуська.;ещё;ʂtʂ;1928;intervoc;91
36374;егп1928;f;20140624b-egp-1;http://www.parasolcorpus.org/Pushkino/OUT/20140624b-egp-1-1267270-1278395.wav;Кто - то, я ещё счастливая, на оборонных не была, #ещё# хоть только в лес, а другие ведь и вот, которые постарше меня хотя бы на год, вот Дуська - то, на оборонных была ведь.;ещё;ʂtʂ;1928;intervoc;91
36456;егп1928;f;20140624b-egp-1;http://www.parasolcorpus.org/Pushkino/OUT/20140624b-egp-1-1291747-1298883.wav;А как же не тяжелее? Там = здесь - то дом близко, дак все ра = все равно то и картошки привезут, то и #ещё# - то такого ещё.;ещё;ʂtʂ;1928;intervoc;91
36460;егп1928;f;20140624b-egp-1;http://www.parasolcorpus.org/Pushkino/OUT/20140624b-egp-1-1291747-1298883.wav;А как же не тяжелее? Там = здесь - то дом близко, дак все ра = все равно то и картошки привезут, то и ещё - то такого #ещё# .;ещё;ʂtʂ;1928;intervoc;91
33801;егп1928;f;20140624b-egp-1;http://www.parasolcorpus.org/Pushkino/OUT/20140624b-egp-1-15558-18349.wav;Дак в Акичкине дак ведь #ещё# есть.;ещё;ʂtʂ;1928;intervoc;91
37459;егп1928;f;20140624b-egp-1;http://www.parasolcorpus.org/Pushkino/OUT/20140624b-egp-1-1669607-1674671.wav;У нас = у нас - то #ещё# , Галя, в этой, на Дерюге ещё запань была.;ещё;ʂtʂ;1928;intervoc;91
33813;егп1928;f;20140624b-egp-1;http://www.parasolcorpus.org/Pushkino/OUT/20140624b-egp-1-19869-22128.wav;Вот, а Акичкине - то ведь там живут #ещё# .;ещё;ʂtʂ;1928;intervoc;91
40197;егп1928;f;20140624b-egp-1;http://www.parasolcorpus.org/Pushkino/OUT/20140624b-egp-1-2795102-2801757.wav;А #ещё# ... а ещё надо ведь, что напрясть - то дак на это, дак на мотовилы ещё мотали.;ещё;ʂtʂ;1928;intervoc;91
40595;егп1928;f;20140624b-egp-1;http://www.parasolcorpus.org/Pushkino/OUT/20140624b-egp-1-2940822-2952611.wav;Да мама сразу вроде как и молилася, я помню, вот тоже это, #ещё# я маленькая, небольшая была, а отец у нас был коммунистом, в партии был, вот.;ещё;ʂtʂ;1928;intervoc;91
41393;егп1928;f;20140624b-egp-1;http://www.parasolcorpus.org/Pushkino/OUT/20140624b-egp-1-3224386-3236265.wav;Вот мы с Катькой <? > сейчас на кладбище встречаемся, дак она #ещё# все поминает: мамка, говорит, у меня = мать, говорит, у меня умирала дак ещё, говорит, На =... Ага, Настасью, говорит, все ещё поминала.;ещё;ʂtʂ;1928;intervoc;91
41508;егп1928;f;20140624b-egp-1;http://www.parasolcorpus.org/Pushkino/OUT/20140624b-egp-1-3254519-3259068.wav;Не помню, я ещё ма = небольшая была, я #ещё# маленькая была.;ещё;ʂtʂ;1928;intervoc;91
34944;егп1928;f;20140624b-egp-1;http://www.parasolcorpus.org/Pushkino/OUT/20140624b-egp-1-578893-583328.wav;А раньше вот #ещё# пока старики жили, ну, у их и молодежь была.;ещё;ʂtʂ;1928;intervoc;91
63780;егп1928;f;N20130623e;http://www.parasolcorpus.org/Pushkino/OUT/N20130623e-1216986-1220505.wav;он под снегом лежит, дак весной - то #ещё# мы бегали,;ещё;ʂtʂ;1928;intervoc;91
61453;егп1928;f;N20130623e;http://www.parasolcorpus.org/Pushkino/OUT/N20130623e-143440-145440.wav;Есть #ещё# бабушки старше.;ещё;ʂtʂ;1928;intervoc;91
64480;егп1928;f;N20130623e;http://www.parasolcorpus.org/Pushkino/OUT/N20130623e-1574537-1576594.wav;Тогда мы #ещё# этого не знали.;ещё;ʂtʂ;1928;intervoc;91
64750;егп1928;f;N20130623e;http://www.parasolcorpus.org/Pushkino/OUT/N20130623e-1707102-1709593.wav;Сплавом, сейчас #ещё# на машинах возят - то.;ещё;ʂtʂ;1928;intervoc;91
43075;егп1928;f;20140624b-egp-1;http://www.parasolcorpus.org/Pushkino/OUT/20140624b-egp-1-3823838-3830694.wav;В плену - то так мучили человека, мужиков да этих вот и #женщин# , пришли домой, ещё в тюрьму посадили.;женщин;ʂtʂ;1928;son;91
65127;егп1928;f;N20130623e;http://www.parasolcorpus.org/Pushkino/OUT/N20130623e-1866653-1869666.wav;Мужики работали, даже #женщин# не было - всё мужики работали.;женщин;ʂtʂ;1928;son;91
297106;егп1928;f;20130705c-egp;http://www.parasolcorpus.org/Pushkino/OUT/20130705c-egp-239511-248187.wav;Только. А так у нас никого нету. Вот... вот эта сейчас #женщина# - жена нашего младшего сына.;женщина;ʂtʂ;1928;son;91
298014;егп1928;f;20130705c-egp;http://www.parasolcorpus.org/Pushkino/OUT/20130705c-egp-625449-635657.wav;А колхозных - то специально была #женщина# поставлен. У нас Катька Аполлонова, наверное, была, овец кормила.;женщина;ʂtʂ;1928;son;91
33840;егп1928;f;20140624b-egp-1;http://www.parasolcorpus.org/Pushkino/OUT/20140624b-egp-1-30041-35816.wav;Из старших дак я не знаю, она у дочери тоже в Строевском жила, Марьей зовут, #женщина# .;женщина;ʂtʂ;1928;son;91
41459;егп1928;f;20140624b-egp-1;http://www.parasolcorpus.org/Pushkino/OUT/20140624b-egp-1-3237920-3242905.wav;Это моя мама да вот там #женщина# в Бестужеве одна есть.;женщина;ʂtʂ;1928;son;91
302043;егп1928;f;20130705c-egp;http://www.parasolcorpus.org/Pushkino/OUT/20130705c-egp-2407442-2417189.wav;Вот тогда, я помню, отец у нас пахал, на тракторе ещё с этой напа = ну, с одной #женщиной# , девкой уж.;женщиной;ʂtʂ;1928;son;91
305966;егп1928;f;20130705c-egp;http://www.parasolcorpus.org/Pushkino/OUT/20130705c-egp-3996239-4001389.wav;Свалят опять на кого - нибудь, на какую #женщину# и посадят безвинного человека.;женщину;ʂtʂ;1928;son;91
36646;егп1928;f;20140624b-egp-1;http://www.parasolcorpus.org/Pushkino/OUT/20140624b-egp-1-1367617-1370130.wav;Обе было две де = #женщины# , две девки.;женщины;ʂ:;1928;son;91
39688;егп1928;f;20140624b-egp-1;http://www.parasolcorpus.org/Pushkino/OUT/20140624b-egp-1-2598653-2603554.wav;А бедные тогда #женщины# , день лен мнут, а ночь треплют.;женщины;ʂ:;1928;son;91
64664;егп1928;f;N20130623e;http://www.parasolcorpus.org/Pushkino/OUT/N20130623e-1662405-1665320.wav;Вот постарше - то были только вот которые #женщины# ,;женщины;ʂ:;1928;son;91
65184;егп1928;f;N20130623e;http://www.parasolcorpus.org/Pushkino/OUT/N20130623e-1891580-1894691.wav;А #женщины# тоже на лесозаготовках были.;женщины;ʂ:;1928;son;91
65214;егп1928;f;N20130623e;http://www.parasolcorpus.org/Pushkino/OUT/N20130623e-1902332-1904468.wav;Какие - то #женщины# на фермах работали,;женщины;ʂ:;1928;son;91
305274;егп1928;f;20130705c-egp;http://www.parasolcorpus.org/Pushkino/OUT/20130705c-egp-3733582-3739597.wav;И мы тоже так же все - у нас были женщины, ко = в партии были, #женщины# .;женщины;ʂtʂ;1928;son;91
35862;егп1928;f;20140624b-egp-1;http://www.parasolcorpus.org/Pushkino/OUT/20140624b-egp-1-1054688-1066290.wav;С ро = розну =... там... с = старших там, которые постарше, может, старики, старик, ещё уж на войну он уж негож, да #женщины# .;женщины;ʂtʂ;1928;son;91
305266;егп1928;f;20130705c-egp;http://www.parasolcorpus.org/Pushkino/OUT/20130705c-egp-3733582-3739597.wav;И мы тоже так же все - у нас были #женщины# , ко = в партии были, женщины.;женщины;ʂtʂ;1928;son;91
64541;егп1928;f;N20130623e;http://www.parasolcorpus.org/Pushkino/OUT/N20130623e-1607169-1610376.wav;Тогда не пекли, а сейчас молодые #женщины# пекут.;женщины;ʂtʂ;1928;son;91
34180;егп1928;f;20140624b-egp-1;http://www.parasolcorpus.org/Pushkino/OUT/20140624b-egp-1-310147-319317.wav;ещё как на круг поставят, вот сделается тебе с = и #ищут# корову, сделается корова, что = колода какая - то, вот дерево.;ищут;ʂtʂ;1928;intervoc;91
41388;егп1928;f;20140624b-egp-1;http://www.parasolcorpus.org/Pushkino/OUT/20140624b-egp-1-3224386-3236265.wav;Вот мы с Катькой <? > сейчас на #кладбище# встречаемся, дак она ещё все поминает: мамка, говорит, у меня = мать, говорит, у меня умирала дак ещё, говорит, На =... Ага, Настасью, говорит, все ещё поминала.;кладбище;ʂ:;1928;intervoc;91
64308;егп1928;f;N20130623e;http://www.parasolcorpus.org/Pushkino/OUT/N20130623e-1487904-1489583.wav;А тоже на #кладбище# ходят.;кладбище;ʂ:;1928;intervoc;91
64313;егп1928;f;N20130623e;http://www.parasolcorpus.org/Pushkino/OUT/N20130623e-1490282-1491895.wav;Тоже на #кладбище# ходят.;кладбище;ʂ:;1928;intervoc;91
64291;егп1928;f;N20130623e;http://www.parasolcorpus.org/Pushkino/OUT/N20130623e-1468471-1470725.wav;А на Троицу на #кладбище# тоже ходят.;кладбище;ʂtʂ;1928;intervoc;91
64296;егп1928;f;N20130623e;http://www.parasolcorpus.org/Pushkino/OUT/N20130623e-1471310-1472895.wav;На #кладбище# ходят.;кладбище;ʂtʂ;1928;intervoc;91
64334;егп1928;f;N20130623e;http://www.parasolcorpus.org/Pushkino/OUT/N20130623e-1506226-1510566.wav;В Троицу - то батюшка не бывает на #кладбище# , а в Прокопьев день вот видишь...;кладбище;ʂtʂ;1928;intervoc;91
36888;егп1928;f;20140624b-egp-1;http://www.parasolcorpus.org/Pushkino/OUT/20140624b-egp-1-1470394-1477618.wav;Одна у другой спрашивает: " А ты как и помогаешь #навальщику# , дак по = вот, правда или нет помогаешь?;навальщику;ʂtʂ;1928;son;91
299693;егп1928;f;20130705c-egp;http://www.parasolcorpus.org/Pushkino/OUT/20130705c-egp-1366974-1369792.wav;А тогда и внимания не #обращали# .;обращали;ʂtʂ;1928;intervoc;91
299817;егп1928;f;20130705c-egp;http://www.parasolcorpus.org/Pushkino/OUT/20130705c-egp-1450085-1456355.wav;В больницу уже #обращались# - это я имею в виду, когда я ещё была вот такая, там, на этой Сметане.;обращались;ʂtʂ;1928;intervoc;91
37088;егп1928;f;20140624b-egp-1;http://www.parasolcorpus.org/Pushkino/OUT/20140624b-egp-1-1540530-1552061.wav;Они свалят в = в это, в снег, сверху < сучья > обчистят, а на низу там... не о = не #обчищено# , дак вот попробуй - ка из этого снега это бревно выворотить.;обчищено;ʂtʂ;1928;intervoc;91
35206;егп1928;f;20140624b-egp-1;http://www.parasolcorpus.org/Pushkino/OUT/20140624b-egp-1-742094-752528.wav;Ну да... Коля - то, Николай - то Николаевич, оне с ним #общаются# , ведь оне, этот домик вот Коля им купил, Николай Николаевич.;общаются;ʂ:;1928;stop;91
300886;егп1928;f;20130705c-egp;http://www.parasolcorpus.org/Pushkino/OUT/20130705c-egp-1901601-1903744.wav;Всё было #общее# , всё было колхозное.;общее;ʂ:;1928;stop;91
296773;егп1928;f;20130705c-egp;http://www.parasolcorpus.org/Pushkino/OUT/20130705c-egp-132044-135273.wav;В общем, в #общем# , сама себя...;общем;ʂ:;1928;stop;91
296770;егп1928;f;20130705c-egp;http://www.parasolcorpus.org/Pushkino/OUT/20130705c-egp-132044-135273.wav;В #общем# , в общем, сама себя...;общем;ʂ:;1928;stop;91
37229;егп1928;f;20140624b-egp-1;http://www.parasolcorpus.org/Pushkino/OUT/20140624b-egp-1-1604273-1607511.wav;В Костылеве там были = в Октябрьском в #общем# была запань.;общем;ʂ:;1928;stop;91
42468;егп1928;f;20140624b-egp-1;http://www.parasolcorpus.org/Pushkino/OUT/20140624b-egp-1-3609609-3633011.wav;Дак вот у нас недавно на сельсовет пришла, в #общем# позвонили ли, телеграмма ли пришла, что спрашивают вот Алешку - то Петрушонка, что Лоскутов Алексей Петрович, и Лоскутова Евгения Трофимовна, это Алешиха, из Польши нали звонит, вот родственники видно какие - то там, ещё ли.;общем;ʂ:;1928;stop;91
62325;егп1928;f;N20130623e;http://www.parasolcorpus.org/Pushkino/OUT/N20130623e-551007-553401.wav;Неплохо, в #общем# , сказать.;общем;ʂ:;1928;stop;91
304022;егп1928;f;20130705c-egp;http://www.parasolcorpus.org/Pushkino/OUT/20130705c-egp-3216039-3220545.wav;Нам Галина Красную площадь показывала, на Красной #площади# были в Москве.;площади;ʂ:;1928;intervoc;91
62572;егп1928;f;N20130623e;http://www.parasolcorpus.org/Pushkino/OUT/N20130623e-662197-667521.wav;Срезала, потом смахивала с #площадки# на землю, а мы вязали снопы.;площадки;ʂtʂ;1928;intervoc;91
304017;егп1928;f;20130705c-egp;http://www.parasolcorpus.org/Pushkino/OUT/20130705c-egp-3216039-3220545.wav;Нам Галина Красную #площадь# показывала, на Красной площади были в Москве.;площадь;ʂ:;1928;intervoc;91
297293;егп1928;f;20130705c-egp;http://www.parasolcorpus.org/Pushkino/OUT/20130705c-egp-328818-333190.wav;Дак вот #продавщица# - то та и есть Серёжи вот, я сказала. Ага.;продавщица;ʂtʂ;1928;fr;91
299848;егп1928;f;20130705c-egp;http://www.parasolcorpus.org/Pushkino/OUT/20130705c-egp-1456355-1461824.wav;Фомин Починок у нас. Пишется Фомин починок, однако #прозвище# " Сметана ".;прозвище;ʂtʂ;1928;intervoc;91
299856;егп1928;f;20130705c-egp;http://www.parasolcorpus.org/Pushkino/OUT/20130705c-egp-1464768-1466730.wav;Да я и #прозвище# скажу.;прозвище;ʂtʂ;1928;intervoc;91
61487;егп1928;f;N20130623e;http://www.parasolcorpus.org/Pushkino/OUT/N20130623e-161610-164280.wav;Фомин починок, а по #прозвищу# сметана.;прозвищу;ʂ:;1928;intervoc;91
35393;егп1928;f;20140624b-egp-1;http://www.parasolcorpus.org/Pushkino/OUT/20140624b-egp-1-828791-832716.wav;А по = по = по ранешному по #прозвищу# там Ильдина, а у нас Пушкина.;прозвищу;ʂtʂ;1928;intervoc;91
39014;егп1928;f;20140624b-egp-1;http://www.parasolcorpus.org/Pushkino/OUT/20140624b-egp-1-2323871-2326926.wav;Поля маленькая была, та ещё только #родящая# .;родящая;ʂtʂ;1928;intervoc;91
37831;егп1928;f;20140624b-egp-1;http://www.parasolcorpus.org/Pushkino/OUT/20140624b-egp-1-1848340-1856858.wav;У #рубщиков# был свой бракер, он принимал лес, как называется, принимал лес у рубщиков, вот.;рубщиков;ʂtʂ;1928;stop;91
37846;егп1928;f;20140624b-egp-1;http://www.parasolcorpus.org/Pushkino/OUT/20140624b-egp-1-1848340-1856858.wav;У рубщиков был свой бракер, он принимал лес, как называется, принимал лес у #рубщиков# , вот.;рубщиков;ʂtʂ;1928;stop;91
43462;егп1928;f;20140624b-egp-1;http://www.parasolcorpus.org/Pushkino/OUT/20140624b-egp-1-3947835-3957366.wav;Вот... не знаю я, видно, у кого какой плен был ли что ли, а тут у одних дак, даже только что домой пришел и обратно #тащили# .;тащили;ʂtʂ;1928;intervoc;91
301340;егп1928;f;20130705c-egp;http://www.parasolcorpus.org/Pushkino/OUT/20130705c-egp-2081028-2082644.wav;Бабушку отсель #утащил# .;утащил;ʂtʂ;1928;intervoc;91
43526;егп1928;f;20140624b-egp-1;http://www.parasolcorpus.org/Pushkino/OUT/20140624b-egp-1-3972076-3980334.wav;Да, дома был, дома там был на Сметане, ночь ли две ли ночевал, опять при =... приех = пришли люди и #утащили# .;утащили;ʂ:;1928;intervoc;91
63308;егп1928;f;N20130623e;http://www.parasolcorpus.org/Pushkino/OUT/N20130623e-989798-994358.wav;А там уж в #училище# в Каргополе учились.;училище;ʂ:;1928;intervoc;91
63318;егп1928;f;N20130623e;http://www.parasolcorpus.org/Pushkino/OUT/N20130623e-994947-997998.wav;Это... педагогическое #училище# было.;училище;ʂtʂ;1928;intervoc;91
296967;егп1928;f;20130705c-egp;http://www.parasolcorpus.org/Pushkino/OUT/20130705c-egp-190466-199760.wav;То... сказал тоже вот тот врач, говорит, " Ты, Пушкина, радей ( радуйся ) того, что у тебя какой - то, он сказал, нерв не #ущемило# ".;ущемило;ʂtʂ;1928;intervoc;91
39397;егп1928;f;20140624b-egp-1;http://www.parasolcorpus.org/Pushkino/OUT/20140624b-egp-1-2488631-2504176.wav;Жениху вот, который сватался - то, с Шалимова - то который сватался дак, вино - то выпили, надо - то платить, а кто платить - то будет, вот он и ей #хвощет# , иди, я чем платить буду, как у меня нет денег.;хвощет;ʂtʂ;1928;intervoc;91
39446;егп1928;f;20140624b-egp-1;http://www.parasolcorpus.org/Pushkino/OUT/20140624b-egp-1-2514694-2522601.wav;Одежду, одежду на машинке шила, она может = может и изо льна оде = это, #холщовое# .;холщовое;ʂtʂ;1928;son;91
40132;егп1928;f;20140624b-egp-1;http://www.parasolcorpus.org/Pushkino/OUT/20140624b-egp-1-2748144-2755883.wav;У каждого, пожалуй, были дома, потому что не было было одеть - то ничего, только в этом, в #холщовом# ходили.;холщовом;ʂtʂ;1928;son;91
299875;егп1928;f;20130705c-egp;http://www.parasolcorpus.org/Pushkino/OUT/20130705c-egp-1467632-1476653.wav;Там потому что приезжали попы, там на разные праздники да всё, и их одаривали #щедро# сметаной.;щедро;ʂtʂ;1928;first;91
297521;егп1928;f;20130705c-egp;http://www.parasolcorpus.org/Pushkino/OUT/20130705c-egp-427767-435957.wav;Шесть которую растеребишь, которая грязная, отбросишь, которая чистая дак щётки, чешешь #щётками# .;щётками;ʂtʂ;1928;first;91
39837;егп1928;f;20140624b-egp-1;http://www.parasolcorpus.org/Pushkino/OUT/20140624b-egp-1-2665060-2668964.wav;< Ще = Щеть > такая, #щетки# такие были.;щетки;ʂtʂ;1928;first;91
297518;егп1928;f;20130705c-egp;http://www.parasolcorpus.org/Pushkino/OUT/20130705c-egp-427767-435957.wav;Шесть которую растеребишь, которая грязная, отбросишь, которая чистая дак #щётки# , чешешь щётками.;щётки;ʂtʂ;1928;first;91
59631;егп1928;f;20140624b-egp-1;http://www.parasolcorpus.org/Pushkino/OUT/20140624b-egp-1-2665060-2668964.wav;< Ще = #Щеть# > такая, щетки такие были.;Щеть;ʂtʂ;1928;first;91
39827;егп1928;f;20140624b-egp-1;http://www.parasolcorpus.org/Pushkino/OUT/20140624b-egp-1-2653528-2663599.wav;Да, да, вот надо = надо потрепать и трепать надо хорошенько, чтобы костица вся отлетела, а потом ещё #щетью# чешут.;щетью;ʂtʂ;1928;first;91
59645;егп1928;f;20140624b-egp-1;http://www.parasolcorpus.org/Pushkino/OUT/20140624b-egp-1-2670716-2685841.wav;< #Щетью# > этой вычешут лен, это значит и тонко - тонко прядут, и л = лен, и ленного прядено, и рубахи шили, кальсоны мужикам и = и платья, и как если красочка какая есть, дак накрасят дак и красиво.;Щетью;ʂtʂ;1928;first;91
214691;ент1968;f;20140703g-ent-1;http://www.parasolcorpus.org/Pushkino/OUT/20140703g-ent-1-1047843-1054199.wav;И все. Там пост = вообще одежду, постельное белье, там #вещи# разные. Ну все, что угодно.;вещи;ɕ:;1968;intervoc;51
216484;ент1968;f;20140703g-ent-1;http://www.parasolcorpus.org/Pushkino/OUT/20140703g-ent-1-1867522-1870349.wav;Везде работают, но, в принципе, все равно #возвращаются# .;возвращаются;ɕ:;1968;intervoc;51
214684;ент1968;f;20140703g-ent-1;http://www.parasolcorpus.org/Pushkino/OUT/20140703g-ent-1-1047843-1054199.wav;И все. Там пост = #вообще# одежду, постельное белье, там вещи разные. Ну все, что угодно.;вообще;ɕ:;1968;stop;51
214875;ент1968;f;20140703g-ent-1;http://www.parasolcorpus.org/Pushkino/OUT/20140703g-ent-1-1134100-1139583.wav;Да... Дорогие. Сейчас вот тарифы подняли на п = на почте - газеты #вообще# сильно подорожали.;вообще;ɕ:;1968;stop;51
215107;ент1968;f;20140703g-ent-1;http://www.parasolcorpus.org/Pushkino/OUT/20140703g-ent-1-1236594-1244079.wav;В том году огурцы уже в это время солили, а в этом году только - только на еду набираем. #Вообще# ничего нет.;Вообще;ɕ:;1968;stop;51
215113;ент1968;f;20140703g-ent-1;http://www.parasolcorpus.org/Pushkino/OUT/20140703g-ent-1-1247380-1250521.wav;У нас #вообще# пого = ну было так, немного в июне одно время.;вообще;ɕ:;1968;stop;51
215148;ент1968;f;20140703g-ent-1;http://www.parasolcorpus.org/Pushkino/OUT/20140703g-ent-1-1250521-1257450.wav;И все. И все дожди, дожди, дожди... А в том году какая шикарная погода была. #Вообще# ни одного дождя.;Вообще;ɕ:;1968;stop;51
